{
  "schemaVersion": "1.0.0",
  "exportTimestamp": "2026-10-25T12:00:00.0000000Z",
  "unityVersion": "2022.3.40f1",
  "targetName": "HUD",
  "targetType": "Prefab",
  "canvasContext": {
    "renderMode": "ScreenSpaceOverlay",
    "pixelPerfect": false,
    "sortingOrder": 0,
    "scaler": {
      "uiScaleMode": "ScaleWithScreenSize",
      "referenceResolution": {
        "x": 1920.0,
        "y": 1080.0
      },
      "matchWidthOrHeight": 0.5
    }
  },
  "root": {
    "id": "/HUD",
    "name": "HUD",
    "activeSelf": true,
    "activeInHierarchy": true,
    "tag": "Untagged",
    "layer": "UI",
    "rect": {
      "anchorMin": { "x": 0.0, "y": 0.0 },
      "anchorMax": { "x": 1.0, "y": 1.0 },
      "pivot": { "x": 0.5, "y": 0.5 },
      "anchoredPosition": { "x": 0.0, "y": 0.0 },
      "sizeDelta": { "x": 0.0, "y": 0.0 },
      "resolvedRect": {
        "x": 0.0,
        "y": 0.0,
        "width": 1920.0,
        "height": 1080.0
      }
    },
    "components": [
      {
        "typeName": "Canvas",
        "enabled": true,
        "properties": {
          "renderMode": "ScreenSpaceOverlay"
        }
      }
    ],
    "children": [
      {
        "id": "/HUD/HealthBar",
        "name": "HealthBar",
        "activeSelf": true,
        "activeInHierarchy": true,
        "tag": "Untagged",
        "layer": "UI",
        "rect": {
          "anchorMin": { "x": 0.0, "y": 1.0 },
          "anchorMax": { "x": 0.0, "y": 1.0 },
          "pivot": { "x": 0.5, "y": 0.5 },
          "anchoredPosition": { "x": 160.0, "y": -40.0 },
          "sizeDelta": { "x": 240.0, "y": 32.0 },
          "resolvedRect": {
            "x": 40.0,
            "y": 1024.0,
            "width": 240.0,
            "height": 32.0
          }
        },
        "components": [
          {
            "typeName": "Image",
            "enabled": true,
            "properties": {
              "color": "D93333FF",
              "fillAmount": 0.85,
              "raycastTarget": false
            }
          }
        ],
        "children": []
      },
      {
        "id": "/HUD/SettingsButton",
        "name": "SettingsButton",
        "activeSelf": true,
        "activeInHierarchy": true,
        "tag": "Untagged",
        "layer": "UI",
        "rect": {
          "anchorMin": { "x": 1.0, "y": 1.0 },
          "anchorMax": { "x": 1.0, "y": 1.0 },
          "pivot": { "x": 0.5, "y": 0.5 },
          "anchoredPosition": { "x": -48.0, "y": -48.0 },
          "sizeDelta": { "x": 64.0, "y": 64.0 },
          "resolvedRect": {
            "x": 1840.0,
            "y": 1000.0,
            "width": 64.0,
            "height": 64.0
          }
        },
        "components": [
          {
            "typeName": "Image",
            "enabled": true,
            "properties": {
              "color": "3373D9FF",
              "raycastTarget": true
            }
          },
          {
            "typeName": "Button",
            "enabled": true,
            "properties": {
              "interactable": true
            },
            "listeners": []
          }
        ],
        "children": []
      }
    ]
  },
  "statistics": {
    "totalNodeCount": 3,
    "activeNodeCount": 3,
    "interactableCount": 1,
    "textElementCount": 0,
    "maxHierarchyDepth": 2
  }
}
